{
  "log_id": "1d2e3f4a-5b6c-4d7e-8f9a-0b1c2d3e4f5a",
  "trace_id": "9e8d7c6b-5a4f-4e3d-9c2b-1a0f9e8d7c6b",
  "span_id": "5f4e3d2c-1b0a-4f9e-8d7c-6b5a4f3e2d1c",
  "correlation_id": "lead-7841c9a2-f0e1-4d3c-b2a1-908f7e6d5c4b",
  "tenant_id": "tenant_dealer_astra_motors",
  "emitting_component": "agent.lead_scoring_agent",
  "severity": "INFO",
  "timestamp": "2026-07-31T03:12:44Z",
  "message": "Lead scored and classified as Hot",
  "context": {
    "prompt_version": "lead_scoring.v1.2.0",
    "model": "claude-sonnet-5",
    "input_summary": "3 WhatsApp replies, 1 test-drive request",
    "output_summary": "score=87, classification=hot",
    "confidence": 0.93
  },
  "metadata": {
    "lead_score": 87,
    "classification": "hot"
  },
  "pii_redacted": true,
  "alert_dispatched": false,
  "retention_class": "standard"
}
